{
  "schema": "haojue-select-handoff-audit-v1",
  "as_of": "2026-10-07",
  "data_is_provisional": true,
  "hard_rules": "交付_推荐规则",
  "items": [
    {
      "excel_row": 2,
      "model": "GSX-8R",
      "family": "GSX-8R",
      "is_public_service": false,
      "recommendation_eligible_for_screening": true,
      "official_reference_price_cny": 99800,
      "price_usable_for_budget_filter": true,
      "score_notes": "L1/L2/L3混合，分数为应用算法，不是官网官方评级",
      "review_required": true,
      "raw_excel": {
        "分类": "大排量车",
        "车型": "GSX-8R",
        "排量": "776cm³",
        "最大功率": "官网参数页未列出",
        "最大扭矩": "官网参数页未列出",
        "整备质量": "205kg",
        "座高": "810mm",
        "轴距": "1465mm",
        "最小离地间隙": "145mm",
        "油箱容量": "14L",
        "轮胎规格": "前120/70ZR17；后180/55ZR17",
        "制动 / ABS / TCS": "前双盘/后盘；ABS/TCS详见配置页",
        "官方来源": "https://www.haojue.com/GSX8R/canshu.html",
        "数据状态": "已核验（官方页）",
        "官网价格类型": "官方建议零售价",
        "官网当前价格": "¥99,800",
        "价格来源": "https://www.haojue.com/products.html",
        "日常通勤评分": 3,
        "城市短途评分": 3,
        "周末休闲评分": 4,
        "多种场景评分": 3,
        "用途评分依据": "用途分属于产品匹配算法判断，非豪爵官方打分。原有公式与车型结构启发式混合；须人工抽样验证。原始权重35分。",
        "轻松好骑评分": 2,
        "安全配置评分": 5,
        "乘坐舒适评分": 3,
        "储物空间评分": 2,
        "省心耐用评分": 3,
        "关注点评分依据": "安全配置评分=5；原表提及ABS/CBS/TCS，但可能属于版本范围，暂不跨版本断言。舒适/储物/耐用含启发式L3，不得标注为官方评分；请查三层证据审计及交付质量表。",
        "操作方式": "手动离合 / 运动",
        "驾驭门槛（1-5）": 4,
        "门槛评分依据": "统一识别手动；0.40×3+0.35×5+0.15×4+0.10×5=4.05→4（配置多值取首个版本，须确认）"
      }
    },
    {
      "excel_row": 3,
      "model": "DL250-C",
      "family": "DL250",
      "is_public_service": false,
      "recommendation_eligible_for_screening": true,
      "official_reference_price_cny": 20980,
      "price_usable_for_budget_filter": true,
      "score_notes": "L1/L2/L3混合，分数为应用算法，不是官网官方评级",
      "review_required": true,
      "raw_excel": {
        "分类": "跨骑车",
        "车型": "DL250-C",
        "排量": "248mL",
        "最大功率": "18.4kW@8000",
        "最大扭矩": "23.4N·m@6500",
        "整备质量": "206kg",
        "座高": "795mm",
        "轴距": "1430mm",
        "最小离地间隙": "155mm",
        "油箱容量": "17.3L",
        "轮胎规格": "前110/80-17；后140/70-17",
        "制动 / ABS / TCS": "前Φ290盘/后Φ240盘",
        "官方来源": "https://www.haojue.com/product/parameters.html?id=9",
        "数据状态": "已核验（官方页）",
        "官网价格类型": "官方建议零售价",
        "官网当前价格": "¥20,980；官网另显示划线参考价 ¥22,680",
        "价格来源": "https://www.haojue.com/products.html",
        "日常通勤评分": 2,
        "城市短途评分": 2,
        "周末休闲评分": 4,
        "多种场景评分": 2,
        "用途评分依据": "用途分属于产品匹配算法判断，非豪爵官方打分。原有公式与车型结构启发式混合；须人工抽样验证。原始权重35分。",
        "轻松好骑评分": 2,
        "安全配置评分": 3,
        "乘坐舒适评分": 3,
        "储物空间评分": 2,
        "省心耐用评分": 3,
        "关注点评分依据": "安全配置评分=3；未取得版本级ABS/CBS/TCS结论，不能当作无配置。舒适/储物/耐用含启发式L3，不得标注为官方评分；请查三层证据审计及交付质量表。",
        "操作方式": "手动离合 / ADV跨骑",
        "驾驭门槛（1-5）": 4,
        "门槛评分依据": "统一识别手动；0.40×3+0.35×5+0.15×4+0.10×4=3.95→4（配置多值取首个版本，须确认）"
      }
    },
    {
      "excel_row": 4,
      "model": "DL250-A 无三箱",
      "family": "DL250",
      "is_public_service": false,
      "recommendation_eligible_for_screening": true,
      "official_reference_price_cny": 19880,
      "price_usable_for_budget_filter": true,
      "score_notes": "L1/L2/L3混合，分数为应用算法，不是官网官方评级",
      "review_required": true,
      "raw_excel": {
        "分类": "跨骑车",
        "车型": "DL250-A 无三箱",
        "排量": "248mL",
        "最大功率": "18.4kW@8000",
        "最大扭矩": "23.4N·m@6500",
        "整备质量": "188kg",
        "座高": "795mm",
        "轴距": "1430mm",
        "最小离地间隙": "155mm",
        "油箱容量": "17.3L",
        "轮胎规格": "前110/80-17；后140/70-17",
        "制动 / ABS / TCS": "前Φ290盘/后Φ240盘",
        "官方来源": "https://www.haojue.com/product/parameters.html?id=92",
        "数据状态": "已核验（官方页）",
        "官网价格类型": "官方建议零售价",
        "官网当前价格": "¥19,880；官网另显示划线参考价 ¥21,580",
        "价格来源": "https://www.haojue.com/products.html",
        "日常通勤评分": 2,
        "城市短途评分": 2,
        "周末休闲评分": 4,
        "多种场景评分": 2,
        "用途评分依据": "用途分属于产品匹配算法判断，非豪爵官方打分。原有公式与车型结构启发式混合；须人工抽样验证。原始权重35分。",
        "轻松好骑评分": 2,
        "安全配置评分": 3,
        "乘坐舒适评分": 3,
        "储物空间评分": 2,
        "省心耐用评分": 3,
        "关注点评分依据": "安全配置评分=3；未取得版本级ABS/CBS/TCS结论，不能当作无配置。舒适/储物/耐用含启发式L3，不得标注为官方评分；请查三层证据审计及交付质量表。",
        "操作方式": "手动离合 / ADV跨骑",
        "驾驭门槛（1-5）": 4,
        "门槛评分依据": "统一识别手动；0.40×3+0.35×4+0.15×4+0.10×4=3.60→4（配置多值取首个版本，须确认）"
      }
    },
    {
      "excel_row": 5,
      "model": "GSX250R-F",
      "family": "GSX250R",
      "is_public_service": false,
      "recommendation_eligible_for_screening": true,
      "official_reference_price_cny": 18980,
      "price_usable_for_budget_filter": true,
      "score_notes": "L1/L2/L3混合，分数为应用算法，不是官网官方评级",
      "review_required": true,
      "raw_excel": {
        "分类": "跨骑车",
        "车型": "GSX250R-F",
        "排量": "248mL",
        "最大功率": "21.5kW",
        "最大扭矩": "官网参数页待进一步核验",
        "整备质量": "178kg",
        "座高": "790mm",
        "轴距": "官网参数页待进一步核验",
        "最小离地间隙": "官网参数页待进一步核验",
        "油箱容量": "官网参数页待进一步核验",
        "轮胎规格": "官网参数页待进一步核验",
        "制动 / ABS / TCS": "官网参数页待进一步核验",
        "官方来源": "https://en.haojue.com/GSX250R-F/canshu.html",
        "数据状态": "参数已按对应官网页面补录；配置版本差异仍需门店确认",
        "官网价格类型": "官方建议零售价",
        "官网当前价格": "¥18,980",
        "价格来源": "https://www.haojue.com/products.html",
        "日常通勤评分": 3,
        "城市短途评分": 2,
        "周末休闲评分": 4,
        "多种场景评分": 3,
        "用途评分依据": "用途分属于产品匹配算法判断，非豪爵官方打分。原有公式与车型结构启发式混合；须人工抽样验证。原始权重35分。",
        "轻松好骑评分": 2,
        "安全配置评分": 3,
        "乘坐舒适评分": 3,
        "储物空间评分": 2,
        "省心耐用评分": 3,
        "关注点评分依据": "安全配置评分=3；未取得版本级ABS/CBS/TCS结论，不能当作无配置。舒适/储物/耐用含启发式L3，不得标注为官方评分；请查三层证据审计及交付质量表。",
        "操作方式": "六挡往复式",
        "驾驭门槛（1-5）": 4,
        "门槛评分依据": "统一识别手动；0.40×3+0.35×4+0.15×4+0.10×4=3.60→4（配置多值取首个版本，须确认）"
      }
    },
    {
      "excel_row": 6,
      "model": "GSX250R-A",
      "family": "GSX250R",
      "is_public_service": false,
      "recommendation_eligible_for_screening": true,
      "official_reference_price_cny": 19980,
      "price_usable_for_budget_filter": true,
      "score_notes": "L1/L2/L3混合，分数为应用算法，不是官网官方评级",
      "review_required": true,
      "raw_excel": {
        "分类": "跨骑车",
        "车型": "GSX250R-A",
        "排量": "248mL",
        "最大功率": "18.4kW@8000",
        "最大扭矩": "23.4N·m@6500",
        "整备质量": "178kg",
        "座高": "790mm",
        "轴距": "1430mm",
        "最小离地间隙": "160mm",
        "油箱容量": "15L",
        "轮胎规格": "前110/80-17；后140/70-17",
        "制动 / ABS / TCS": "前Φ290盘/后Φ240盘",
        "官方来源": "https://www.haojue.com/product/parameters.html?id=17",
        "数据状态": "已核验（官方页）",
        "官网价格类型": "官方建议零售价",
        "官网当前价格": "¥19,980；官网另显示划线参考价 ¥21,680",
        "价格来源": "https://www.haojue.com/products.html",
        "日常通勤评分": 2,
        "城市短途评分": 2,
        "周末休闲评分": 4,
        "多种场景评分": 2,
        "用途评分依据": "用途分属于产品匹配算法判断，非豪爵官方打分。原有公式与车型结构启发式混合；须人工抽样验证。原始权重35分。",
        "轻松好骑评分": 2,
        "安全配置评分": 3,
        "乘坐舒适评分": 3,
        "储物空间评分": 2,
        "省心耐用评分": 3,
        "关注点评分依据": "安全配置评分=3；未取得版本级ABS/CBS/TCS结论，不能当作无配置。舒适/储物/耐用含启发式L3，不得标注为官方评分；请查三层证据审计及交付质量表。",
        "操作方式": "手动离合 / 仿赛",
        "驾驭门槛（1-5）": 4,
        "门槛评分依据": "统一识别手动；0.40×3+0.35×4+0.15×4+0.10×4=3.60→4（配置多值取首个版本，须确认）"
      }
    },
    {
      "excel_row": 7,
      "model": "DL150",
      "family": "DL150",
      "is_public_service": false,
      "recommendation_eligible_for_screening": true,
      "official_reference_price_cny": 14680,
      "price_usable_for_budget_filter": true,
      "score_notes": "L1/L2/L3混合，分数为应用算法，不是官网官方评级",
      "review_required": true,
      "raw_excel": {
        "分类": "跨骑车",
        "车型": "DL150",
        "排量": "149mL",
        "最大功率": "9.3kW@8000",
        "最大扭矩": "12.7N·m@6000",
        "整备质量": "148kg",
        "座高": "795mm",
        "轴距": "1345mm",
        "最小离地间隙": "160mm",
        "油箱容量": "13L",
        "轮胎规格": "前100/80-17；后130/70-17",
        "制动 / ABS / TCS": "前碟/后碟",
        "官方来源": "https://www.haojue.com/DL150/canshu.html",
        "数据状态": "已核验（官方页）",
        "官网价格类型": "官方建议零售价",
        "官网当前价格": "¥14,680",
        "价格来源": "https://www.haojue.com/products.html",
        "日常通勤评分": 5,
        "城市短途评分": 5,
        "周末休闲评分": 5,
        "多种场景评分": 5,
        "用途评分依据": "用途分属于产品匹配算法判断，非豪爵官方打分。原有公式与车型结构启发式混合；须人工抽样验证。原始权重35分。",
        "轻松好骑评分": 3,
        "安全配置评分": 3,
        "乘坐舒适评分": 5,
        "储物空间评分": 2,
        "省心耐用评分": 3,
        "关注点评分依据": "安全配置评分=3；未取得版本级ABS/CBS/TCS结论，不能当作无配置。舒适/储物/耐用含启发式L3，不得标注为官方评分；请查三层证据审计及交付质量表。",
        "操作方式": "手动离合 / 跨骑",
        "驾驭门槛（1-5）": 3,
        "门槛评分依据": "统一识别手动；0.40×3+0.35×3+0.15×4+0.10×2=3.05→3（配置多值取首个版本，须确认）"
      }
    },
    {
      "excel_row": 8,
      "model": "DR150S",
      "family": "DR150S",
      "is_public_service": false,
      "recommendation_eligible_for_screening": true,
      "official_reference_price_cny": 12880,
      "price_usable_for_budget_filter": true,
      "score_notes": "L1/L2/L3混合，分数为应用算法，不是官网官方评级",
      "review_required": true,
      "raw_excel": {
        "分类": "跨骑车",
        "车型": "DR150S",
        "排量": "149mL",
        "最大功率": "9.1kW@7500",
        "最大扭矩": "12.7N·m@6000",
        "整备质量": "148kg",
        "座高": "790mm",
        "轴距": "1340mm",
        "最小离地间隙": "168mm",
        "油箱容量": "12L",
        "轮胎规格": "前100/80R17；后130/70R17",
        "制动 / ABS / TCS": "前碟/后碟",
        "官方来源": "https://www.haojue.com/product/parameters.html?id=35",
        "数据状态": "已核验（官方页）",
        "官网价格类型": "官方建议零售价",
        "官网当前价格": "¥12,880",
        "价格来源": "https://www.haojue.com/products.html",
        "日常通勤评分": 3,
        "城市短途评分": 2,
        "周末休闲评分": 4,
        "多种场景评分": 3,
        "用途评分依据": "用途分属于产品匹配算法判断，非豪爵官方打分。原有公式与车型结构启发式混合；须人工抽样验证。原始权重35分。",
        "轻松好骑评分": 3,
        "安全配置评分": 3,
        "乘坐舒适评分": 3,
        "储物空间评分": 2,
        "省心耐用评分": 3,